{"version":1,"operation":"merge","circuit":"merge","circuit_version":"0.1.0","backend":"mock","proof":{"format":"mock-envelope-v1","bytes":"7b226b696e64223a226d6f636b2d656e76656c6f70652d7631222c2263697263756974223a226d65726765222c22636972637569745f76657273696f6e223a22302e312e30222c226261636b656e64223a226d6f636b222c22766572696669636174696f6e5f6b65795f6964223a226d6f636b2d766b2f6d657267652f302e312e30222c2261727469666163745f636865636b73756d223a2265356566626436313965343163326632663564396164633436363732653766376162303733366438633131393132613264333238646262363632393737386534222c227075626c69635f6f757470757473223a7b22656e7472696573223a5b5b22746f6b656e5f61646472657373222c2237343666366236353665225d2c5b226163636f756e745f61646472657373222c22363837313934346562333865613735383636643432363039333032363932613535653132636637363230613530663263663033333831623962333832623732225d2c5b22636f6d6d69746d656e745f61222c2232326436356663306137343265383137363565646531393033376535376335326239616530313932313336313139343130323034356632623534666163353961225d2c5b22636f6d6d69746d656e745f62222c2232346663356564323232643565336663376432323938386236656338623038313630663162303031323335636434363365653566643639326665393165373532225d2c5b22726f6f745f6869222c226162616261626162616261626162616261626162616261626162616261626162225d2c5b22726f6f745f6c6f222c226162616261626162616261626162616261626162616261626162616261626162225d5d7d2c2273746174655f7265666572656e6365223a7b22726f6f74223a2261626162616261626162616261626162616261626162616261626162616261626162616261626162616261626162616261626162616261626162616261626162222c2273657175656e6365223a312c226c6162656c223a226d657267652d76616c69642d303031227d7d7710e1ed4acead7766333cde9ed7d6ac73a2f77660537efa50651da5fcb4d1b2"},"public_outputs":{"entries":[["token_address","746f6b656e"],["account_address","6871944eb38ea75866d42609302692a55e12cf7620a50f2cf03381b9b382b72"],["commitment_a","22d65fc0a742e81765ede19037e57c52b9ae01921361194102045f2b54fac59a"],["commitment_b","24fc5ed222d5e3fc7d22988b6ec8b08160f1b001235cd463ee5fd692fe91e752"],["root_hi","abababababababababababababababab"],["root_lo","abababababababababababababababab"]]},"verification_key_id":"mock-vk/merge/0.1.0","artifact_checksum":"e5efbd619e41c2f2f5d9adc46672e7f7ab0736d8c11912a2d328dbb6629778e4","state_reference":{"root":"abababababababababababababababababababababababababababababababab","sequence":1,"label":"merge-valid-001"},"metadata":{"request_id":"vector-merge-valid-001","produced_by":"crucible-prover/0.1.0"}}