{"version":1,"operation":"register","circuit":"register","circuit_version":"0.1.0","backend":"mock","proof":{"format":"mock-envelope-v1","bytes":"7b226b696e64223a226d6f636b2d656e76656c6f70652d7631222c2263697263756974223a227265676973746572222c22636972637569745f76657273696f6e223a22302e312e30222c226261636b656e64223a226d6f636b222c22766572696669636174696f6e5f6b65795f6964223a226d6f636b2d766b2f72656769737465722f302e312e30222c2261727469666163745f636865636b73756d223a2235393338393531373165353137396536373363386165333234393866353162666234393231366636376636343433353031633364663435396666303837373937222c227075626c69635f6f757470757473223a7b22656e7472696573223a5b5b226163636f756e745f61646472657373222c22363837313934346562333865613735383636643432363039333032363932613535653132636637363230613530663263663033333831623962333832623732225d5d7d2c2273746174655f7265666572656e6365223a6e756c6c7df1e4a26e83d7a3570713ffa1dd2a335c9ba26af313191c78c6dd84e876ecef00"},"public_outputs":{"entries":[["account_address","6871944eb38ea75866d42609302692a55e12cf7620a50f2cf03381b9b382b72"]]},"verification_key_id":"mock-vk/register/0.1.0","artifact_checksum":"593895171e5179e673c8ae32498f51bfb49216f67f6443501c3df459ff087797","state_reference":null,"metadata":{"request_id":"vector-register-valid-001","produced_by":"crucible-prover/0.1.0"}}