{"version":1,"operation":"withdraw","circuit":"withdraw","circuit_version":"0.1.0","backend":"mock","proof":{"format":"mock-envelope-v1","bytes":"7b226b696e64223a226d6f636b2d656e76656c6f70652d7631222c2263697263756974223a227769746864726177222c22636972637569745f76657273696f6e223a22302e312e30222c226261636b656e64223a226d6f636b222c22766572696669636174696f6e5f6b65795f6964223a226d6f636b2d766b2f77697468647261772f302e312e30222c2261727469666163745f636865636b73756d223a2238613630333164376166303662333139613937356231363664643731303763656131353437396132353231613739653163633431666464336436636537346163222c227075626c69635f6f757470757473223a7b22656e7472696573223a5b5b22746f6b656e5f61646472657373222c2237343666366236353665225d2c5b226163636f756e745f61646472657373222c22363837313934346562333865613735383636643432363039333032363932613535653132636637363230613530663263663033333831623962333832623732225d2c5b22636f6d6d69746d656e74222c22373664623333353532643933616133306636333538303864316361323961386530336464316635663339366266326361663764663835613830333865326430225d2c5b22726f6f745f6869222c226162616261626162616261626162616261626162616261626162616261626162225d2c5b22726f6f745f6c6f222c226162616261626162616261626162616261626162616261626162616261626162225d5d7d2c2273746174655f7265666572656e6365223a7b22726f6f74223a2261626162616261626162616261626162616261626162616261626162616261626162616261626162616261626162616261626162616261626162616261626162222c2273657175656e6365223a312c226c6162656c223a2277697468647261772d76616c69642d303031227d7d414a9ae959bb8c8b7dd424899bb6fd750141d72956b1d30068cd4129dbb9aa36"},"public_outputs":{"entries":[["token_address","746f6b656e"],["account_address","6871944eb38ea75866d42609302692a55e12cf7620a50f2cf03381b9b382b72"],["commitment","76db33552d93aa30f635808d1ca29a8e03dd1f5f396bf2caf7df85a8038e2d0"],["root_hi","abababababababababababababababab"],["root_lo","abababababababababababababababab"]]},"verification_key_id":"mock-vk/withdraw/0.1.0","artifact_checksum":"8a6031d7af06b319a975b166dd7107cea15479a2521a79e1cc41fdd3d6ce74ac","state_reference":{"root":"abababababababababababababababababababababababababababababababab","sequence":1,"label":"withdraw-valid-001"},"metadata":{"request_id":"vector-withdraw-valid-001","produced_by":"crucible-prover/0.1.0"}}