{"version":1,"operation":"transfer","circuit":"transfer","circuit_version":"0.1.0","backend":"mock","proof":{"format":"mock-envelope-v1","bytes":"7b226b696e64223a226d6f636b2d656e76656c6f70652d7631222c2263697263756974223a227472616e73666572222c22636972637569745f76657273696f6e223a22302e312e30222c226261636b656e64223a226d6f636b222c22766572696669636174696f6e5f6b65795f6964223a226d6f636b2d766b2f7472616e736665722f302e312e30222c2261727469666163745f636865636b73756d223a2230383433333738313931663936316232636439656439633232633461376238333636326136353433396330373663666136353533613661663639316538316337222c227075626c69635f6f757470757473223a7b22656e7472696573223a5b5b22746f6b656e5f61646472657373222c2237343666366236353665225d2c5b2273656e6465725f61646472657373222c22363837313934346562333865613735383636643432363039333032363932613535653132636637363230613530663263663033333831623962333832623732225d2c5b22726563697069656e745f61646472657373222c2231636535653639393739313331643861336131653361613863653065333963653066306531376233646533326165643835393037623161646661376138653232225d2c5b226f6c645f73656e6465725f636f6d6d69746d656e74222c22373664623333353532643933616133306636333538303864316361323961386530336464316635663339366266326361663764663835613830333865326430225d2c5b22726f6f745f6869222c226162616261626162616261626162616261626162616261626162616261626162225d2c5b22726f6f745f6c6f222c226162616261626162616261626162616261626162616261626162616261626162225d5d7d2c2273746174655f7265666572656e6365223a7b22726f6f74223a2261626162616261626162616261626162616261626162616261626162616261626162616261626162616261626162616261626162616261626162616261626162222c2273657175656e6365223a312c226c6162656c223a227472616e736665722d76616c69642d303031227d7dff5f3f98fde108df4161fc14d18f7b64e20c635c75e4a736cdbe5ce23e4894e0"},"public_outputs":{"entries":[["token_address","746f6b656e"],["sender_address","6871944eb38ea75866d42609302692a55e12cf7620a50f2cf03381b9b382b72"],["recipient_address","1ce5e69979131d8a3a1e3aa8ce0e39ce0f0e17b3de32aed85907b1adfa7a8e22"],["old_sender_commitment","76db33552d93aa30f635808d1ca29a8e03dd1f5f396bf2caf7df85a8038e2d0"],["root_hi","abababababababababababababababab"],["root_lo","abababababababababababababababab"]]},"verification_key_id":"mock-vk/transfer/0.1.0","artifact_checksum":"0843378191f961b2cd9ed9c22c4a7b83662a65439c076cfa6553a6af691e81c7","state_reference":{"root":"abababababababababababababababababababababababababababababababab","sequence":1,"label":"transfer-valid-001"},"metadata":{"request_id":"vector-transfer-valid-001","produced_by":"crucible-prover/0.1.0"}}